{
  "version": "1.0.0",
  "created": "2026-02-27",
  "description": "MBA-relevant role taxonomy with O*NET occupation codes, skill requirements, and motivation profiles",
  "roles": [
    {
      "role_id": "product-manager",
      "role_name": "Product Manager (Tech)",
      "onet_code": "11-2021.00",
      "category": "product",
      "description": "Drives product strategy, roadmap, and execution for technology products. MBA interns typically own a feature or product area, working cross-functionally with engineering, design, and data teams.",
      "required_skills": [
        "Product Roadmapping",
        "Stakeholder Management",
        "Data Analysis",
        "User Research",
        "Cross-Functional Leadership",
        "Strategic Planning",
        "Communication",
        "Critical Thinking"
      ],
      "preferred_skills": [
        "SQL",
        "A/B Testing",
        "Agile Methodology",
        "Prototyping",
        "Python"
      ],
      "barrier_conditions": [
        "No demonstrated interest in technology or digital products",
        "Unable to articulate user-centric thinking or empathy for end users",
        "No experience working cross-functionally or influencing without authority"
      ],
      "expected_signals": [
        "Prior product ownership or product-adjacent experience",
        "Evidence of data-informed decision making",
        "Track record of shipping features or products end-to-end",
        "Technical fluency demonstrated through projects or prior roles"
      ],
      "motivation_attributes": {
        "impact_orientation": "high",
        "capital_allocation": "low",
        "innovation": "high",
        "leadership_scale": "moderate",
        "autonomy": "high",
        "stability_vs_volatility": "moderate",
        "prestige_sensitivity": "moderate"
      },
      "bls_data": {
        "bls_top_skills": [
          "Problem solving and decision making",
          "Adaptability",
          "Speaking and listening"
        ],
        "bls_median_wage_2024": 161030,
        "bls_typical_education": "Bachelor's degree",
        "bls_employment_growth_pct_2024_34": 6.6
      }
    },
    {
      "role_id": "product-manager-healthcare",
      "role_name": "Product Manager (HealthTech)",
      "onet_code": "11-2021.00",
      "category": "product",
      "description": "Manages product strategy for healthcare technology platforms including EHR systems, telehealth, clinical decision support, and patient engagement tools. MBA interns navigate regulated environments while driving user-centered innovation.",
      "required_skills": [
        "Product Roadmapping",
        "Stakeholder Management",
        "User Research",
        "Regulatory Awareness",
        "Data Analysis",
        "Cross-Functional Leadership",
        "Communication",
        "Critical Thinking"
      ],
      "preferred_skills": [
        "Healthcare Domain Knowledge",
        "HIPAA Compliance",
        "Clinical Workflow Understanding",
        "SQL",
        "Agile Methodology"
      ],
      "barrier_conditions": [
        "No interest in healthcare or social impact domains",
        "Discomfort working within heavy regulatory constraints",
        "No experience with complex stakeholder environments"
      ],
      "expected_signals": [
        "Prior healthcare, biotech, or life sciences experience",
        "Evidence of navigating regulated or compliance-heavy environments",
        "Demonstrated empathy for patient or clinician end users",
        "Interest in health equity or access articulated in application materials"
      ],
      "motivation_attributes": {
        "impact_orientation": "high",
        "capital_allocation": "low",
        "innovation": "high",
        "leadership_scale": "moderate",
        "autonomy": "moderate",
        "stability_vs_volatility": "moderate",
        "prestige_sensitivity": "low"
      },
      "bls_data": {
        "bls_top_skills": [
          "Problem solving and decision making",
          "Adaptability",
          "Speaking and listening"
        ],
        "bls_median_wage_2024": 161030,
        "bls_typical_education": "Bachelor's degree",
        "bls_employment_growth_pct_2024_34": 6.6
      }
    },
    {
      "role_id": "product-manager-edtech",
      "role_name": "Product Manager (EdTech)",
      "onet_code": "11-2021.00",
      "category": "product",
      "description": "Leads product development for education technology platforms including LMS, adaptive learning, and student engagement tools. MBA interns balance pedagogical outcomes with product metrics and business viability.",
      "required_skills": [
        "Product Roadmapping",
        "User Research",
        "Stakeholder Management",
        "Data Analysis",
        "Communication",
        "Strategic Planning",
        "Cross-Functional Leadership",
        "Active Listening"
      ],
      "preferred_skills": [
        "Education Domain Knowledge",
        "Learning Science Familiarity",
        "A/B Testing",
        "Agile Methodology",
        "Accessibility Standards"
      ],
      "barrier_conditions": [
        "No passion for education or learning outcomes",
        "Inability to balance mission-driven work with business metrics",
        "No experience with user research or empathy-driven design"
      ],
      "expected_signals": [
        "Prior teaching, tutoring, or education sector experience",
        "Demonstrated interest in learning outcomes and student success",
        "Experience building or improving tools for non-technical users",
        "Evidence of mission-driven career trajectory"
      ],
      "motivation_attributes": {
        "impact_orientation": "high",
        "capital_allocation": "low",
        "innovation": "high",
        "leadership_scale": "moderate",
        "autonomy": "moderate",
        "stability_vs_volatility": "high",
        "prestige_sensitivity": "low"
      },
      "bls_data": {
        "bls_top_skills": [
          "Problem solving and decision making",
          "Adaptability",
          "Speaking and listening"
        ],
        "bls_median_wage_2024": 161030,
        "bls_typical_education": "Bachelor's degree",
        "bls_employment_growth_pct_2024_34": 6.6
      }
    },
    {
      "role_id": "management-consultant",
      "role_name": "Management Consultant",
      "onet_code": "13-1111.00",
      "category": "consulting",
      "description": "Advises organizations on operational efficiency, organizational strategy, and business transformation. MBA interns work on client engagements solving structured business problems with data-driven recommendations.",
      "required_skills": [
        "Problem Solving",
        "Data Analysis",
        "Communication",
        "Presentation Skills",
        "Stakeholder Management",
        "Strategic Planning",
        "Critical Thinking",
        "Project Management"
      ],
      "preferred_skills": [
        "Financial Modeling",
        "Market Research",
        "Change Management",
        "Industry Expertise",
        "Excel Advanced"
      ],
      "barrier_conditions": [
        "Inability to structure ambiguous problems into workable frameworks",
        "Poor communication or presentation skills",
        "Unwillingness to travel or work in high-intensity client environments"
      ],
      "expected_signals": [
        "Strong case interview performance or structured thinking examples",
        "Prior client-facing or advisory experience",
        "Evidence of rapid learning across industries",
        "Leadership in team-based project delivery"
      ],
      "motivation_attributes": {
        "impact_orientation": "moderate",
        "capital_allocation": "low",
        "innovation": "moderate",
        "leadership_scale": "moderate",
        "autonomy": "low",
        "stability_vs_volatility": "moderate",
        "prestige_sensitivity": "high"
      },
      "bls_data": {
        "bls_top_skills": [
          "Adaptability",
          "Writing and reading",
          "Problem solving and decision making"
        ],
        "bls_median_wage_2024": 101190,
        "bls_typical_education": "Bachelor's degree",
        "bls_employment_growth_pct_2024_34": 8.8
      }
    },
    {
      "role_id": "strategy-consultant",
      "role_name": "Strategy Consultant",
      "onet_code": "13-1111.00",
      "category": "consulting",
      "description": "Focuses on high-level corporate strategy including market entry, growth strategy, M&A diligence, and competitive positioning. MBA interns conduct deep market analyses and develop strategic recommendations for C-suite clients.",
      "required_skills": [
        "Strategic Planning",
        "Competitive Analysis",
        "Financial Modeling",
        "Market Research",
        "Communication",
        "Critical Thinking",
        "Data Analysis",
        "Presentation Skills"
      ],
      "preferred_skills": [
        "M&A Analysis",
        "Industry Mapping",
        "Scenario Planning",
        "Executive Communication",
        "Due Diligence"
      ],
      "barrier_conditions": [
        "No quantitative or analytical foundation",
        "Inability to synthesize large amounts of information into clear recommendations",
        "No demonstrated interest in business strategy or competitive dynamics"
      ],
      "expected_signals": [
        "Prior strategy, corporate development, or investment banking experience",
        "Strong academic record in analytical or quantitative disciplines",
        "Published analyses, strategy case competition wins, or thought leadership",
        "Evidence of CEO-level or board-level communication ability"
      ],
      "motivation_attributes": {
        "impact_orientation": "moderate",
        "capital_allocation": "moderate",
        "innovation": "moderate",
        "leadership_scale": "high",
        "autonomy": "low",